Lien,Numéro Brevet,Titre,Date de publication,Mots-clés,Description,Domaine Technologique,Inventeurs,Titulaire du brevet,Statut du brevet,Résumé,Problème,Solution
https://patents.google.com/patent/US10319125B2,US10319125B2,"Method, system, and computer-readable medium for creating and laying out a graphic within an application program",2017-06-29,"method,, apparatus,, computer-readable, medium, creating","
     A method, apparatus, and computer-readable medium are provided for creating and laying out a graphic within a drawing application program. The method includes receiving a data model defining a set of data and data relationships to be represented in the graphic, receiving a graphic definition describing the mapping of the data from the data model to a set of algorithms, algorithm parameters, constraints, constraint rules, and shape properties, determining a shape size and position for the layout nodes utilizing the set of algorithms, constraints, and constraint rules from the graphic definition, and creating a list of shapes and shape properties for the graphic, including size and position. The method further includes determining if the graphic fits a given layout into a specific area based on the set of constraint values and if the graphic does not fit the specific area, then modifying the set of constraint values using the constraint rules. 
   
   ",Intelligence Artificielle,"Janet L. Schorr, Stephen T. Wells, Matthew Kotler, Thomas C. Underhill, Scott A. Sherman, Ilan Berker",Microsoft Technology Licensing LLC,Expired - Fee Related,,,
https://patents.google.com/patent/US10319128B2,US10319128B2,Augmented reality presentation of an industrial environment,2016-12-27,"industrial, visualization, system, generates, augmented, reality, presentations, rendering","
     A industrial visualization system generates augmented reality presentations for rendering on a user's wearable computer as the user traverses an industrial facility. The system can leverage data indexed in a federated data model that unifies plant-wide data from multiple diverse sources under a common namespace. By leveraging the unified plant data and interacting with a wearable computer worn by a user, the augmented reality presentation system provides automation system data, notifications, and proactive guidance to a user via modification of the user's view of his or her immediate surroundings. Such modifications can include superimposing data values or indicators on the user's view of a machine or automation system through the user's wearable computer. The system can customize presentation of this information based on the user's role, location, line of sight, type of wearable device, and/or other contextual information. 
   
   ",Sécurité,"Sharon M. Billi-Duran, Christopher W. Como, Edward A. GRAY, Kyle K. Reissner, Jonathan D. Walter, Mohit Singhai, Douglas J. Reichard, Scott N. Sandler, Ronald E. Bliss, Michael J. Pantaleano, Ryan CAHALANE, Jessica L. Korpela, Bruce T. McCleave, JR.",Rockwell Automation Technologies Inc,"Active, expires 2037-01-13",,,
https://patents.google.com/patent/US10319129B2,US10319129B2,Snapping line generation,2017-01-27,"Techniques, systems, described, snapping, line, generation, based","
     Techniques and systems are described for snapping line generation based on glyphs. Techniques include locating bounding box lines from bounding boxes of glyphs. The bounding box lines may then be analyzed to identify which of the bounding box lines are collinear and at least one snapping line is generated based on the collinearity of the bounding box lines. The generated snapping lines are then output in a user interface to facilitate snapping objects to the snapping line. 
   
   ",Autre,"Praveen Kumar Dhanuka, Neeraj Nandkeolyar, Chirag Maheshwari",Adobe Inc,Active,,,
https://patents.google.com/patent/US10319130B2,US10319130B2,Anonymization of facial images,2017-05-01,"method, facilitates, use, facial, images, through, anonymization","
     A method facilitates the use of facial images through anonymization of facial images, thereby allowing people to submit their own facial images without divulging their identities. Original facial images are accessed and perturbed to generate synthesized facial images. Personal identities contained in the original facial images are no longer discernable from the synthesized facial images. At the same time, each synthesized facial image preserves at least some of the original attributes of the corresponding original facial image. 
   
   ",Intelligence Artificielle,"Jacob WHITEHILL, Javier R. Movellan, Ian Fasel",Apple Inc,Expired - Fee Related,,,
https://patents.google.com/patent/US10319141B2,US10319141B2,Method and system for vision based 3D reconstruction and object tracking,2016-06-21,"Three, dimensional, model, construction, obtaining, first, image","
     Three dimensional model construction includes obtaining a first image of an object captured by a first camera facing a first direction, obtaining a second image of the object captured by a second camera facing a second direction, wherein the second camera captures the second image of the object as a reflection in a mirror, determining a virtual baseline distance between the first camera and a device including the second camera based on a location of the first camera, a known spatial relationship between the first camera and the device, and a reflected distance of the second camera, and generating at least a partial 3D model of the first object using the first image, the second image, and the virtual baseline distance. 
   
   ",Intelligence Artificielle,Lejing Wang,Apple Inc,"Active, expires 2036-11-13",,,
https://patents.google.com/patent/US10319143B2,US10319143B2,Volumetric grid generation in a domain with heterogeneous material properties,2015-07-23,"Method, generating, 3D, grid,, defining","
     Method for generating a 3D grid, and for defining a material property model on the grid, to use, for example, in a reservoir simulator. A mapping is defined ( 61,71 ) to a design space in which the material property is described as a piecewise smooth implicit or explicit function in three dimensions. Grid geometry is constructed only in the physical space of the model ( 62 - 65,   73 - 76 ), and no grid is required in the design space. The material property, for example permeability, is sampled in the design space ( 66,77 ) to populate the cells in the grid constructed in the physical domain. Prismatic grid cells may be truncated based on faults and horizons ( 65 ), or maybe conformed to fault surfaces using a 3D parameterization of the model ( 76 ). Only forward mapping, i.e. from the physical domain to the design space, is required. 
   
   ",Télécommunications,"Larisa V. Branets, Valeriy Kubyak, Elena Kartasheva, Valeriy Shmyrov, Olga Kroshkina, Dmitry Kandybor, Xiao-Hui Wu",ExxonMobil Upstream Research Co,"Active, expires 2035-07-30",,,
https://patents.google.com/patent/US10319144B2,US10319144B2,Computational localization of fibrillation sources,2016-12-22,"system, computational, localization, fibrillation, sources, provided.","
     A system for computational localization of fibrillation sources is provided. In some implementations, the system performs operations comprising generating a representation of electrical activation of a patient's heart and comparing, based on correlation, the generated representation against one or more stored representations of hearts to identify at least one matched representation of a heart. The operations can further comprise generating, based on the at least one matched representation, a computational model for the patient's heart, wherein the computational model includes an illustration of one or more fibrillation sources in the patient's heart. Additionally, the operations can comprise displaying, via a user interface, at least a portion of the computational model. Related systems, methods, and articles of manufacture are also described. 
   
   ",Télécommunications,"David E. Krummen, Andrew D. McCulloch, Christopher Villongco, Gordon Ho","Office of General Counsel of VA, University of California San Diego UCSD",Active,,,
https://patents.google.com/patent/US10319146B2,US10319146B2,Visual localisation,2013-09-23,"embodiment, invention, there","
     In an embodiment of the invention there is provided a method of visual localization, comprising: generating a plurality of virtual views, wherein each of the virtual views is associated with a location; obtaining a query image; determining the location where the query image was obtained on the basis of a comparison of the query image with said virtual views. 
   
   ",Télécommunications,"Eckehard Steinbach, Robert Huitl, Georg Schroth, Sebastian Hilsenbeck",Navvis GmbH,Active,,,
https://patents.google.com/patent/US10319147B2,US10319147B2,Direct volume rendering in virtual and/or augmented reality,2016-10-17,"Performing, volume, rendering, virtual, reality, environment, by, applying","
     Performing volume rendering in a virtual reality environment by applying an adapted Monte Carlo integration, grid accelerator-based view ray tracing, image filtering, and user-movement detected adapted frame compensation. 
   
   ",Autre,"Falko Löffler, Baul Bönisch, Christian Götze, Andreas Suchanek",Carl Zeiss Microscopy Software Center Rostock GmbH,Active,,,
https://patents.google.com/patent/US10319152B2,US10319152B2,Methods and devices for selecting objects in images,2017-01-19,"Methods, devices, selecting, objects, images, described.","
     Methods and devices for selecting objects in images are described. In one example aspect, a method includes: receiving stereoscopic image data, the stereoscopic image data includes a first image obtained from a first camera and a second image obtained from a second camera; identifying an object in the first image by analyzing the first image and the second image; displaying the first image, the identified object in the first image being selectable. 
   
   ",Intelligence Artificielle,Steven Henry Fyke,BlackBerry Ltd,"Active, expires 2032-07-03",,,
https://patents.google.com/patent/US10319157B2,US10319157B2,System and method for automatic maintenance,2017-03-21,"Systems, methods, automatic, maintenance, autonomous, vehicle","
     Systems and methods for automatic maintenance of an autonomous vehicle include: identifying a maintenance requirement for an autonomous vehicle, wherein identifying a maintenance requirement includes using one or more sensors to obtain vehicle maintenance data; in response to identifying the maintenance requirement, generating a maintenance request comprising a description or data relating to the maintenance requirement; transmitting the maintenance request; receiving maintenance instructions comprising maintenance routing instructions and a maintenance schedule for a maintenance session for resolving the maintenance requirement; and implementing the maintenance instructions. 
   
   ",Télécommunications,"Gautier Minster, Solomon Bier, Matthias Wisniowski","GM Global Technology Operations LLC, GM Cruise LLC","Active, expires 2037-07-27",,,
https://patents.google.com/patent/US10318882B2,US10318882B2,Optimized training of linear machine learning models,2014-09-11,"indication, data, source, used","
     An indication of a data source to be used to train a linear prediction model is obtained. The model is to generate predictions using respective parameters assigned to a plurality of features derived from observation records of the data source. The parameter values are stored in a parameter vector. During a particular learning iteration of the training phase of the model, one or more features for which parameters are to be added to the parameter vector are identified. In response to a triggering condition, parameters for one or more features are removed from the parameter vector based on an analysis of relative contributions of the features represented in the parameter vector to the model's predictions. After the parameters are removed, at least one parameter is added to the parameter vector. 
   
   ",Intelligence Artificielle,"Michael Brueckner, Daniel Blick",Amazon Technologies Inc,"Active, expires 2036-10-27",,,
https://patents.google.com/patent/US10318941B2,US10318941B2,"Payment platform interface widget generation apparatuses, methods and systems",2013-08-13,"PAYMENT, PLATFORM, INTERFACE, WIDGET, GENERATION, APPARATUSES,, METHODS, SYSTEMS","
     The PAYMENT PLATFORM INTERFACE WIDGET GENERATION APPARATUSES, METHODS AND SYSTEMS (“API-Tool”) transforms developer credentials, codes and parameter inputs via the API-Tool component into buy widgets, payment acceptance and purchase transaction outputs. In one embodiment, the API-Tool may facilitate obtaining a plurality of authentication parameters and widget customization parameters. The API-Tool may authenticate a user using a parameter derived from the plurality of authentication parameters and may dynamically generate a purchase widget for the authenticated user using the plurality of widget customization parameters. 
   
   ",Intelligence Artificielle,"Pawan Chawla, Manav Gupta",Visa International Service Association,Active,,,
https://patents.google.com/patent/US10319022B2,US10319022B2,Apparatus and method for processing a multimedia commerce service,2014-02-28,"multimedia, commerce, brand, offering, environment, disclosed., Herein,","
     A multimedia commerce brand offering environment is disclosed. Herein, a method for processing a multimedia commerce service includes the steps of storing service usage pattern data of a user using the multimedia commerce service, sensing a user action from a CPE of the user using the multimedia commerce service, comparing the sensed user action with the stored service usage pattern data of the user, extracting service usage pattern data of the user in accordance with the user action, and providing recommended commerce service information respective to the extracted service usage pattern data of the user. 
   
   ",Sécurité,"Jim CLAYTON, Hojoo PARK, Junhee Kim, Hanseok Kim, Jungnam PARK, Youngah KIM",LG Electronics Inc,"Active, expires 2037-03-23",,,
https://patents.google.com/patent/US10319161B2,US10319161B2,System and method for keyless access control system,2017-07-27,"system, method, keyless, physical, access, control","
     A system and method for a keyless physical access control system, including keyless access to locks, is described. An access reader integrates a capacitive touch sensor and an RFID reader; the expected interference in operation of the capacitive touch sensor due to the excitation signal generated by the RFID antenna is avoided by selectively turning the RFID antenna on and off at periodic time intervals. The time intervals are selected to be long enough so that both the capacitive touch sensor and the RFID reader can operate normally during respective time intervals to unlock a lock, but short enough so that a user does not notice any delay in operation. 
   
   ",Télécommunications,"Thomas Bennett, Roy Luther Johnson, III",Unikey Technnologies Inc,Active,,,
https://patents.google.com/patent/US10319163B2,US10319163B2,Remote control unlocking and locking system,2014-07-10,"portable,, temporary, removable, system, locking, unlocking","
     A portable, temporary removable system for locking and unlocking a door knob, door lever or locking deadbolt without the requirement of using keyed entry. Several manners of automated locking and unlocking are introduced and the instant system is designed for quick installation and removal. Once attached, the system may be remotely controlled from the outside of the door via a pattern of knocks, via electronic communications or a combination of a knock pattern and electronic communication. 
   
   ",Autre,Matthew Murphy,Individual,Active,,,
https://patents.google.com/patent/US10319165B2,US10319165B2,Wireless locking device,2018-11-20,"electronic, locking, device, can, configured, become, active","
     An electronic locking device can be configured to become active from a low power state, receive physical input to unlock, and provide access to a replaceable power supply. An electronic locking device can use a combination of physical input and discovery of an authorized mobile device to enable transition from a locked state to an unlocked state. Authorization can be internally stored or externally obtained through a service. An electronic locking device can match a series of physical interactions to a series of stored interactions to enable transition from a locked state to an unlocked state, when an authorized device is unavailable. An electronic locking device can provide access to a replaceable power supply when a latch is released. 
   
   ",Intelligence Artificielle,"David P. Gengler, Arthur Healey, Cameron Gibbs",Noke Inc,Active,,,
https://patents.google.com/patent/US10319166B2,US10319166B2,Vehicle-based identification and access,2017-05-01,"method, conducting, interaction, using, vehicle","
     A method for conducting an interaction using a vehicle is disclosed. A vehicle can be identified based on one or more vehicle characteristics, including a license plate number, a make, a model, and a color. A user credential can be identified based on the vehicle and used for an interaction. Additionally, user contact information can be identified based on the vehicle and the user can be contacted to approve the interaction. 
   
   ",Télécommunications,"Sivanarayana Gaddam, Gaurav Kohli, Gyan Prakash",Visa International Service Association,Active,,,
https://patents.google.com/patent/US10319168B2,US10319168B2,Quality control method for paper money authentication and system therefor,2015-07-13,"quality, control, method, banknote, identification","
     Provided are a quality control method for banknote identification and a quality control system for banknote identification. The quality control method for banknote identification includes: obtaining a multispectral signal collected by a contact image sensor (CIS); extracting a first eigenvalue of the multispectral signal; obtaining a corresponding second eigenvalue according to the first eigenvalue and a pre-set correction conversion value; and inputting the second eigenvalue into a banknote classifier to obtain a corresponding banknote classification result. 
   
   ",Télécommunications,"Siwei Liu, Rongqiu Wang, Gang Lei, Zheng Zhao",GRG Banking Equipment Co Ltd,"Active, expires 2035-07-19",,,
https://patents.google.com/patent/US10319170B2,US10319170B2,Folded bill identification method and device,2015-07-13,"folded, bill, recognizing, method, folded, bill, recognizing","
     A folded bill recognizing method and a folded bill recognizing device are provided. The folded bill recognizing device includes: a bill input port configured to receive a to-be-recognized bill or a sample bill; a signal collecting module configured to collect a CIS image of the bill, to obtain an infrared transmission image T and an infrared reflection image F; a signal recognizing module configured to recognize whether the to-be-recognized bill has a fold; and a receiving/rejecting module configured to perform a receiving or rejecting operation on the to-be-recognized bill. The device can effectively recognize a folded bill. 
   
   ",Télécommunications,"Guanglu LIU, Jian Chen, Zhuming Xiao, Weirui ZHENG",GRG Banking Equipment Co Ltd,"Active, expires 2035-07-22",,,
https://patents.google.com/patent/US10319172B2,US10319172B2,Banknote crack detection method and apparatus,2015-07-13,"banknote, crack, detection, method, banknote, crack, detection","
     A banknote crack detection method and a banknote crack detection apparatus are provided. The banknote crack detection apparatus includes an image collection unit, configured to collect an optical transmission image of an inputted banknote, a pre-processing unit, configured to receive a banknote image signal collected by the image collection unit, and perform foreground region positioning and cutting on the banknote image signal; a crack detection unit, configured to detect whether a crack exists; and a determining unit, configured to determine whether the banknote is qualified according to a detection result of the crack detection unit; and a control unit, configured to control operation of each of the above units. 
   
   ",Télécommunications,"Yuanchao Yu, Rongqiu Wang, Zhanfeng Huang",GRG Banking Equipment Co Ltd,Active,,,
https://patents.google.com/patent/US10319173B2,US10319173B2,Vending store inventory management and reporting system,2009-10-22,"data, center, supporting, network, system, vending, products","
     A data center supporting a network system for vending products to customers and associated vending methods are provided. The network system includes a data center and a plurality of vending stores remotely located from the data center and connected to the data center through a network interface. The vending stores also include an automated dispensing mechanism for immediate dispensing of purchased products to the customers. The data center may include an enterprise resource planning module and the vending stores may contain user interfaces for collecting inventory and maintenance data during stocking and maintenance. 
   
   ",Télécommunications,"Bradley Scott Adelberg, Walter David Gower Smith, James Henry Hatton, Sabarivasan Viswanathan, Steven Craig Lusardi","Mihi LLC, Newzoom (delaware) LLC","Active, expires 2034-01-23",,,
https://patents.google.com/patent/US10319182B2,US10319182B2,Automatically identifying potentially fraudulent gaming accounts,2016-10-03,"example, embodiments,, method, mitigating, effects","
     In example embodiments, a method of mitigating the effects of fraudulent usage of game accounts is disclosed. One or more values stored in one or more fields of a row of a database table maintained by the game networking system are received. The one or more fields correspond to features of a game account that are relevant to determining whether the game account is potentially being used fraudulently. Based on a combination of the one or more values transgressing a threshold value, it is determined that the game account is potentially being used fraudulently. At least some use of the potentially fraudulent game account is automatically locked to mitigate the effect of the potentially-fraudulent use. 
   
   ",Télécommunications,Jia Wang,Zynga Inc,"Active, expires 2037-01-28",,,
https://patents.google.com/patent/US10319198B2,US10319198B2,Expedited checkout system through portable checkout units,2017-05-01,"expedited, checkout, system, allows, customer, generate","
     An expedited checkout system allows a customer to generate a virtual shopping list on a client application operating on the customer's mobile device, and expedite checkout from a store using the client application. While shopping within a store, a customer can temporarily secure a mobile device to a portable checkout unit that is attached to a shopping cart. The portable checkout unit can receive item identifiers from an item scanner and transmits item identifiers to the customer's mobile device. The customer's mobile device generates a virtual shopping list of the items collected by the customer and, when the customer is ready to check out of the store, the customer can select a checkout option presented on the mobile device. In response to receiving the checkout selection, the mobile device initiates a checkout transaction to check out the customer from the store. 
   
   ",Autre,"Francois Chaubard, Adriano Quiroga Garafulic",Focal Systems Inc,Active,,,
https://patents.google.com/patent/US10319209B2,US10319209B2,Method and system for motion analysis and fall prevention,2017-06-05,"system, method, motion, analysis,, fall, detection,","
     A system and method of motion analysis, fall detection, and fall prediction using machine learning and classifiers. A wearable motion sensor for collecting and transmitting motion data for use in a fall prediction model using features and parameters to classify the motion data and notify when a fall is emergent. Using machine learning, the fall prediction model can be created, implemented, evaluated, and it can evolve over time with additional data. The system and method can use individual data or pool data from various individuals for use in fall prediction. 
   
   ",Intelligence Artificielle,John Carlton-Foss,Individual,Active,,,
https://patents.google.com/patent/US10319220B2,US10319220B2,Control arrangement and control method,2017-04-27,"control, arrangement, communicating, remotely, electronic, device","
     A control arrangement for communicating remotely with an electronic device comprises a local control unit associated with the electronic device, the local control unit comprising a first non-RF spectrum receiver for non-RF spectrum uplink communication signals and a controller coupled to the first receiver for controlling the electronic device based on the received non-RF spectrum uplink communication signals, and a remote control unit with a first non-RF spectrum transmitter for transmitting the non-RF spectrum uplink communication signals to the local control unit. 
   
   ",Télécommunications,"Rajashekar Durai, KokMeng Wong, Henry Foo",Rohde and Schwarz GmbH and Co KG,Active,,,
