Lien,Numéro Brevet,Titre,Date de publication,Mots-clés,Description,Domaine Technologique,Inventeurs,Titulaire du brevet,Statut du brevet,Résumé,Problème,Solution
https://patents.google.com/patent/US10318851B2,US10318851B2,Generating and decoding two-dimensional code,2016-09-09,"two-dimensional, code, generation, method, includes:, performing, multiple, system","
     A two-dimensional code generation method includes: performing a multiple system barcode encoding on hidden information to generate multiple system barcode of hidden encoded information; selecting a corresponding two-dimensional code version to encode standard information to generate to-be-determined standard encoded information; selecting a corresponding mask to generate a bit matrix of a two-dimensional code, and extracting the number of black dots in the bit matrix; updating the selected mask and the two-dimensional code version according to the number of black dots and the length of the hidden encoded information to determine a finally selected mask and two-dimensional code version; generating standard encoded information according to the finally selected mask and two-dimensional code version; and generating a two-dimensional code according to the hidden encoded information and the standard encoded information. 
   
   ",Autre,Xiahong Feng,Alibaba Group Holding Ltd,"Active, expires 2036-11-16",,,
https://patents.google.com/patent/US10318854B2,US10318854B2,Systems and methods for protecting sensitive information stored on a mobile device,2016-05-13,"method, device, protecting, sensitive, information, stored, on","
     A method and device for protecting sensitive information stored on a mobile device capable of wireless communication is described. The protection is provided by permitting wireless transmission of the sensitive information only if data received from an optical sensor or a magnetic sensor satisfies a predetermined requirement. 
   
   ",Sécurité,"Masha Leah Davis, Horst Arnold Mueller",Assa Abloy AB,Active,,,
https://patents.google.com/patent/US10318780B2,US10318780B2,Encoding and decoding data in two-dimensional symbology,2018-08-08,"Examples, techniques, encoding, data, 2D, symbology","
     Examples of techniques for encoding data in a 2D symbology are disclosed. In one example described herein, a computer-implemented method comprises capturing an image of the 2D symbology. The 2D symbology comprises a series of data symbols representing a binary string. Each of the data symbols comprises a line segment, and each data symbol in the series of data symbols are positioned in an end-to-end orientation starting at a starting indicator designated by a first symbol and ending at an ending indicator designated by a second symbol. The first symbol differs from the second symbol, and the series of data symbols comprise 0-bit symbols represented by a first data symbol and 1-bit symbols represented by a second data symbol. The method further comprises extracting the binary string from the 2D symbology by reading each of the data symbols between the starting indicator and the ending indicator. 
   
   ",Télécommunications,"Erich Guenter, Mark E. Maresh, Colm Nolan, Juan F. Vargas, Michael J. Whitney",International Business Machines Corp,Active,,,
https://patents.google.com/patent/US10318810B2,US10318810B2,Systems and methods for determining statistics plant populations based on overhead optical measurements,2016-09-16,"disclosure, describes, system, method, determining","
     This disclosure describes a system and a method for determining statistics of plant populations based on overhead optical measurements. The system may include one or more hardware processors configured by machine-readable instructions to receive output signals provided by one or more remote sensing devices mounted to an overhead platform. The output signals may convey information related to one or more images of a land area where crops are grown. The one or more hardware processors may be configured by machine-readable instructions to distinguish vegetation from background clutter; segregate image regions corresponding to the vegetation from image regions corresponding to the background clutter; and determine a plant count per unit area. 
   
   ",Télécommunications,"Michael Ritter, Michael Milton, Peter Matusov",Slantrange Inc,Active,,,
https://patents.google.com/patent/US10318818B2,US10318818B2,Method and apparatus for detecting suspicious activity using video analysis,2015-11-24,"system, detects, transaction, outcome, by, obtaining, video, data","
     A system detects a transaction outcome by obtaining video data associated with a transaction area and analyzing the video data to obtain at least one video transaction parameter concerning transactions associated with the transaction area. The transaction area can be a video count of items indicated in the video data as detected by an automated item detection algorithm applied to the video data. The system obtains at least one expected transaction parameter concerning an expected transaction that occurs in the transaction area, such as a scan count of items scanned at a point of sale terminal. The system automatically compares the video transaction parameter(s) to the expected transaction parameter(s) to identify a transaction outcome that may indicate fraudulent activity such as sweethearting in a retail environment. 
   
   ",Intelligence Artificielle,"Malay Kundu, Vikram Srinivasan, Joshua Migdal, Xiaowei Chen",NCR Voyix Corp,Active,,,
https://patents.google.com/patent/US10318861B2,US10318861B2,Artificial neuron apparatus,2015-06-17,"resistive, memory, cell, connected, circuitry, which, has","
     A resistive memory cell is connected in circuitry which has a first input terminal for applying neuron input signals including a read portion and a write portion. The circuitry includes a read circuit producing a read signal dependent on resistance of the memory cell, and an output terminal providing a neuron output signal, dependent on the read signal in a first state of the memory cell. The circuitry also includes a storage circuit storing a measurement signal dependent on the read signal, and a switch set operable to supply the read signal to the storage circuit during application of the read portion of each neuron input signal to the memory cell, and, after application of the read portion, to apply the measurement signal in the apparatus to enable resetting of the memory cell to a second state. 
   
   ",Télécommunications,"Evangelos S. Eleftheriou, Angeliki Pantazi, Abu Sebastian, Tomas Tuma",Samsung Electronics Co Ltd,"Active, expires 2038-02-07",,,
https://patents.google.com/patent/US10318862B2,US10318862B2,Transform for a neurosynaptic core circuit,2018-05-15,"Embodiments, invention, provide, method, feature","
     Embodiments of the present invention provide a method for feature extraction comprising generating synaptic connectivity information for a neurosynaptic core circuit. The core circuit comprises one or more electronic neurons, one or more electronic axons, and an interconnect fabric including a plurality of synapse devices for interconnecting the neurons with the axons. The method further comprises initializing the interconnect fabric based on the synaptic connectivity information generated, and extracting a set of features from input received via the electronic axons. The set of features extracted comprises a set of features with reduced correlation. 
   
   ",Télécommunications,"Rathinakumar Appuswamy, Myron D. Flickner, Dharmendra S. Modha",International Business Machines Corp,Expired - Fee Related,,,
https://patents.google.com/patent/US10318863B2,US10318863B2,Systems and methods for autoconfiguration of pattern-recognition controlled myoelectric prostheses,2013-07-24,"Embodiments, invention, provide, prosthesis, guided, training","
     Embodiments of the invention provide for a prosthesis guided training system that includes a plurality of sensors for detecting electromyographic activity. A computing device, which can include a processor and memory, can extract data from the electromyographic activity. A real-time pattern recognition control algorithm and an autoconfiguring pattern recognition training algorithm can be stored in the memory. The computing device can determine movement of a prosthesis based on the execution of the real-time pattern recognition control algorithm. The computing device can also alter operational parameters of the real-time pattern recognition control algorithm based on execution of the autoconfiguring pattern recognition training algorithm. 
   
   ",Intelligence Artificielle,"Blair Lock, Levi Hargrove",Rehabilitation Institute of Chicago,"Active, expires 2035-07-01",,,
https://patents.google.com/patent/US10318864B2,US10318864B2,Leveraging global data for enterprise data analytics,2015-07-24,"deep, learning, network, trained, automatically, analyze, enterprise","
     A deep learning network is trained to automatically analyze enterprise data. Raw data from one or more global data sources is received, and a specific training dataset that includes data exemplary of the enterprise data is also received. The raw data from the global data sources is used to pre-train the deep learning network to predict the results of a specific enterprise outcome scenario. The specific training dataset is then used to further train the deep learning network to predict the results of a specific enterprise outcome scenario. Alternately, the raw data from the global data sources may be automatically mined to identify semantic relationships there-within, and the identified semantic relationships may be used to pre-train the deep learning network to predict the results of a specific enterprise outcome scenario. 
   
   ",Télécommunications,"Li Deng, Jianfeng Gao, Xiaodong He, Prabhdeep Singh",Microsoft Technology Licensing LLC,"Active, expires 2038-04-10",,,
https://patents.google.com/patent/US10318865B2,US10318865B2,Anti-fingerprinting systems and methods for automated task performance,2017-08-04,"Computer-implemented, methods, systems, automatically, performing","
     Computer-implemented methods and systems are provided for automatically performing a task on a remote computer. During a registration stage, the system receives personal information of a human user, obtains an IP address and a device configuration for a computing device, and stores the personal information, IP address, and the device configuration in record in a database. The system receives a request to interact with a remote website to perform a task, the request including the personal information of the human user. The system then retrieves the record from the database using the personal information. The system creates a virtual machine based on the device configuration for the computing device, selects one of a geographically distributed set of proxy servers having an IP geographically address resembling the IP address for the computing device, and executes instructions causing the virtual machine to interact with the remote website using the proxy server to perform the task. 
   
   ",Intelligence Artificielle,"Eric GLYMAN, William James Russell LOCKE, Kathleen ZASADA, Philippe TYAN, Jae In LEE, Karim Atiyeh",Capital One Services LLC,Active,,,
https://patents.google.com/patent/US10318866B2,US10318866B2,Selectivity estimation using artificial neural networks,2015-03-05,"approach, generating, selectivity, estimation,","
     In an approach for generating a selectivity estimation, one or more processors generate an artificial neural network and receive a DBMS query comprising one or more predicates. One or more processors replace one or more predicates in the one or more predicates that have strict operators with one or more predicates that have non-strict operators. One or more processors generate a selectivity function from the one or more predicates that has one or more arguments that are each comprised of an upper bound and a lower bound for a value in a predicate. One or more processors generate a training data set from a data distribution in the database and train the artificial neural network on the training data set to compute the selectivity function. One or more processors generate a selectivity estimation with the artificial neural network for one or more predicates in the DBMS query. 
   
   ",Télécommunications,"Vincent Corvinelli, Huaxin Liu, Mingbin Xu, Ziting Yu, Calisto P. Zuzarte",International Business Machines Corp,"Expired - Fee Related, expires 2036-11-06",,,
https://patents.google.com/patent/US10318867B2,US10318867B2,High-level optimization of mathematical programs based on inductive inference from execution traces,2015-08-28,"method, optimization, program, stored, non-transitory","
     A method for optimization of a program stored in non-transitory storage media includes generating traces for a programmed formula using a hardware processing system and selecting a subset of the traces. One or more substitute formulae are inferred from a plurality of formulae that yield a similar set of traces to the subset of traces. The programmed formula is transformed with a best matched substitute formula to reduce computational complexity. 
   
   ",Autre,Rei Odaira,International Business Machines Corp,"Active, expires 2038-03-20",,,
https://patents.google.com/patent/US10318868B2,US10318868B2,Method for enhancing a mind map with different streams of information,2014-11-11,"Enhancement, first, mind, map, become, second","
     Enhancement of a first mind map to become a second enhanced mind includes: providing a content pool with information items; performing a first semantic scan based on a selected object; and generating a new object and a related connection to the selected object based on the semantic scan. Furthermore, the enhancement includes determining a strength value for each of the connections of the first mind map and determining the connection with the lowest strength value and recalculating the strength value using an external knowledge base to define the connection as obsolete if the strength value decreases. 
   
   ",Autre,"Alessandro Donatelli, Rosario Gangemi, Leonida Gianfagna, Antonio Perrone",International Business Machines Corp,"Expired - Fee Related, expires 2036-12-15",,,
https://patents.google.com/patent/US10318869B2,US10318869B2,Decision-making process for elements in a distributed network,2014-01-07,"decision-making, process, implemented, by, decider, processing, unit.","
     A decision-making process is implemented by a decider processing unit. The decision-making process includes the propagation of a proposition in a distributed network of processing units, with each processing unit being provided with decision intelligence. 
   
   ",Télécommunications,"Christopher RABOTIN, Fabien VALVERDE",Airbus DS SAS,"Active, expires 2036-09-18",,,
https://patents.google.com/patent/US10318873B2,US10318873B2,System and method for determining an expert of a subject on a web-based platform,2014-03-20,"Disclosed, system, determining, expert","
     Disclosed is a system for determining an expert of one or more subjects on a web-based platform. The system comprises a mining module for mining activity data of at least one user of a plurality of users from the web-based platform. The mining module may further compare the activity data with one or more subjects. The mining module may further label the activity data to a subject of the one or more subjects. A scoring module may assign performance points to the at least one user associated to the activity data. The scoring module may further assign subject points to the subject. The scoring module may further generate an activity gauge for the at least one user based on the performance points assigned and the subject points. The scoring module may further classify the at least one user as the expert of the subject. 
   
   ",Télécommunications,"Pratik Kumar Mishra, Dinesh Pothineni, Aadil Rasheed, Deepak Sundararajan, Ashok Krish, Hasit Kaji",Tata Consultancy Services Ltd,"Active, expires 2035-11-21",,,
https://patents.google.com/patent/US10318875B2,US10318875B2,Disease prediction and prevention using crowdsourced reports of environmental conditions,2015-12-07,"Embodiments, invention, provide, techniques, which, utilize, crowdsourced, reports","
     Embodiments of the invention provide techniques which utilize crowdsourced reports of environmental conditions to predict and/or prevent disease outbreaks. In one aspect, a method comprises receiving one or more crowdsourced reports about one or more environmental conditions; inferring one or more input parameters for at least one disease outbreak model based at least in part on the one or more crowdsourced reports; applying the at least one disease outbreak model to at least the one or more inferred parameters to predict one or more characteristics of at least one potential disease outbreak associated with the reported one or more environmental conditions; and, based at least in part on the predicted one or more characteristics, implementing one or more corrective actions to mitigate the at least one potential disease outbreak. 
   
   ",Télécommunications,"Priscilla Barreira Avegliano, Carlos Henrique Cardonha, Julio Nogima",International Business Machines Corp,"Active, expires 2037-11-18",,,
https://patents.google.com/patent/US10318876B2,US10318876B2,Mood detection with intelligence agents,2017-05-25,"Embodiments, invention, provide, systems, methods","
     Embodiments of the present invention provide systems and methods for increasing the quality of interactions between two or more entities. These entities are either individuals (e.g., human beings using a computer device) or artificial intelligence (AI) agents. The interactions between all of the entities within a computing environment are mapped and analyzed. Based on the mapped interactions, a relationship model is generated in order to run multiple applications within a computing environment. 
   
   ",Intelligence Artificielle,"Aaron K. Baughman, Diwesh Pandey, John P. Perrino, Todd R. Whitman",Kyndryl Inc,"Active, expires 2037-06-08",,,
https://patents.google.com/patent/US10318879B2,US10318879B2,Interactive live event outcome selection and prediction,2015-10-30,"method, providing, interactive, interface, live, event","
     A method for providing an interactive interface for live event outcome selection and prediction may include generating a set of cells for an event. The set of cells may be provided to a client device to present in a user interface. A selection of a cell may be received from the client device. The selected cell may be assigned to a user account. The method may generate a coordinate for each cell in the set, wherein each cell coordinate includes a plurality of dimensions, each dimension corresponding to a different entity of the event, and wherein each cell coordinate is unique for the set of cells. The method may comprise calculating, prior to the start of the event, a probability that an event result represented by a cell coordinate will occur; and presenting the probability in association with the cell on the user interface. Other embodiments are described and claimed. 
   
   ",Télécommunications,"Leonard Michael Lopez, Carlos Javier Carbonell Di Mola, Raymond Solebello, Christian J Soblotne, Patrick Mark Quinlivan",CBS Interactive Inc,"Active, expires 2038-03-26",,,
https://patents.google.com/patent/US10318880B2,US10318880B2,Ultra low noise materials and devices for cryogenic superconductors and quantum bits,2015-05-13,"Materials,, devices,, methods, use, fabrication, thereof, disclosed.","
     Materials, devices, methods of use and fabrication thereof are disclosed. The materials are particularly well suited for application in superconducting devices and quantum computing, due to ability to avoid undesirable effects from inherent noise and decoherence. The materials are formed from select isotopes having zero nuclear spin into a single crystal-phase film or layer of thickness depending on the desired application of the resulting device. The film/layer may be suspended or disposed on a substrate. The isotopes may be enriched from naturally-occurring sources of isotopically mixed elemental material(s). The single crystal is preferably devoid of structural defects such as grain boundaries, inclusions, impurities and lattice vacancies. Device configurations may be formed from the layer according to a predetermined pattern using lithographic and/or milling techniques. An optional protective layer may be deposited on some or all of the device to avoid formation of oxides and/or patinas on surfaces of the device. 
   
   ",Intelligence Artificielle,Sergey Pereverzev,Lawrence Livermore National Security LLC,"Active, expires 2037-07-31",,,
https://patents.google.com/patent/US10318883B2,US10318883B2,Identifying optimum times at which to retrain a logistic regression model,2015-03-26,"approach, which, knowledge, manager, trains","
     An approach is provided in which a knowledge manager trains a machine-learning model and generates a hyperplane based upon a first set of labeled feature vectors. The knowledge manager computes, relative to the hyperplane, a first distribution of a first set of feature vectors corresponding to a first set of source documents. Subsequently, the knowledge manager computes, relative to the hyperplane, a second distribution of a second set of feature vectors corresponding to a second group of source documents. The knowledge manager, in turn, generates an indicator to retrain the machine-learning model in response to determining that a distribution difference between the second distribution and the first distribution reaches a distribution difference threshold. 
   
   ",Intelligence Artificielle,Scott N. Gerard,Kyndryl Inc,"Active, expires 2037-09-20",,,
https://patents.google.com/patent/US10318885B2,US10318885B2,Cognitive system virtual corpus training and utilization,2015-09-15,"Mechanisms, implementing, virtual, corpus, engine","
     Mechanisms are provided for implementing a virtual corpus engine that receives an inquiry to be processed and analyzes the inquiry to extract one or more features of the inquiry. The virtual corpus engine selects a weight matrix associated with a virtual corpus based on the extracted one or more features of the inquiry. The virtual corpus comprises a plurality of actual corpora of information. The weight matrix comprises a separate weight value for each actual corpus in the plurality of actual corpora. The virtual corpus engine processes the inquiry using a set of selected actual corpora selected from the plurality of actual corpora based on the weight values in the weight matrix and receives results of the processing of the inquiry using the set of selected actual corpora. The virtual corpus engine outputs the results of the processing of the inquiry. 
   
   ",Télécommunications,"Joseph N. Kozhaya, Christopher M. Madison, Sridhar Sudarsan",International Business Machines Corp,"Expired - Fee Related, expires 2037-09-21",,,
https://patents.google.com/patent/US10318887B2,US10318887B2,Dynamic application degrouping to optimize machine learning model accuracy,2016-06-21,"embodiment,, device, network, identifies","
     In one embodiment, a device in a network identifies a plurality of applications from observed traffic in the network. The device forms two or more application clusters from the plurality of applications. Each of the application clusters includes one or more of the applications, and wherein a particular application in the plurality of applications is included in each of the application clusters. The device generates anomaly detection models for each of the application clusters. The device tests the anomaly detection models, to determine a measure of efficacy for each of the models with respect to traffic associated with the particular application. The device selects a particular anomaly detection model to analyze the traffic associated with the particular application based on the measures of efficacy for each of the models. 
   
   ",Télécommunications,"Jean-Philippe Vasseur, Pierre-André Savalle, Alexandre Honoré",Cisco Technology Inc,"Active, expires 2037-06-10",,,
https://patents.google.com/patent/US10318888B2,US10318888B2,Pre-backing virtual storage using historical learned data,2017-03-06,"computer, system, memory, processor, configured","
     A computer system includes memory and a processor configured to manage memory allocation. Aspects include receiving a request to execute a computer program and obtaining a learned data file for the computer program, the learned data file including a history of memory allocation requests and memory access requests by the computer program. Aspects also include receiving a memory allocation request from the computer program and allocating one or more pages of a virtual memory to the computer program, wherein a size of the one or more pages is based on the learned data file. Aspects further include backing at least one of the one or more pages of the virtual memory in the real memory prior to receiving an access request for the at least one of the one or more pages based on the learned data file. 
   
   ",Intelligence Artificielle,"Joseph W. Gentile, Nicholas C. Matsakis, Elpida Tzortzatos",International Business Machines Corp,Active,,,
