Lien,Numéro Brevet,Titre,Date de publication,Mots-clés,Description,Domaine Technologique,Inventeurs,Titulaire du brevet,Statut du brevet,Résumé,Problème,Solution
https://patents.google.com/patent/US10318886B2,US10318886B2,Anomaly detection with K-means clustering and artificial outlier injection,2015-10-30,"disclosure, directed, towards, systems, methods","
     The present disclosure is directed towards systems and methods for improving anomaly detection using injected outliers. A normalcy calculator of a device may include a set of outliers into a training dataset of data points. The normalcy calculator, using a K-means clustering algorithm applied on the training dataset, identify at least a first cluster of data points. The normalcy calculator of the device may determine a region with a center and an outer radius that covers at least a spatial extent of the first cluster of data points. The normalcy calculator may determine a first normalcy radius for the first cluster by reducing the region around the center until a point at which all artificial outliers are excluded from a region defined by the first normalcy radius. An outlier detector of the device may use the region defined by the first normalcy radius to determine whether a new data point is normal or abnormal. 
   
   ",Intelligence Artificielle,"Nastaran Baradaran, Anoop Reddy, Ratnesh Singh Thakur",Citrix Systems Inc,"Active, expires 2038-01-10",,,
https://patents.google.com/patent/US10318889B2,US10318889B2,Targeted data augmentation using neural style transfer,2017-06-26,"method, training, deep, neural, network, (DNN)","
     A method for training a deep neural network (DNN) to perform a specified task with respect to images captured by a target camera, including: using an image captured by the target camera as a style target image, training a style transformer network to perform a style transformation that transforms any photorealistic input image into a transformed image that has contents of the input image, maintains photorealistic quality of the input image, and has a style that matches a style of the style target image; using the trained style transformer network to transform training image of an original training dataset into transformed training images; labeling the transformed training images with the training labels of the corresponding training image of the original training dataset, to form an augmented training dataset; and using the augmented training dataset to train the DNN to perform the specified task. 
   
   ",Télécommunications,Ting Xu,Konica Minolta Laboratory USA Inc,"Active, expires 2037-10-13",,,
https://patents.google.com/patent/US10318894B2,US10318894B2,Conformance authority reconciliation,2005-08-16,"automated, method, facilitating, management, data, processing","
     An automated method for facilitating management of a data processing environment is disclosed. In various embodiments, the method may include facilitating detecting of a change to an element of a data processing device of the data processing environment. In various embodiments, the method may further include facilitating reconciling the change with a conformance authority, the conformance authority having one or more guidelines. Other embodiments of the present invention may include, but are not limited to, apparatuses adapted to facilitate practice of the above-described method. 
   
   ",Sécurité,"Robert A. DiFalco, Kenneth L. Keeler, Robert L. Warmack",Tripwire Inc,"Active, expires 2027-06-16",,,
https://patents.google.com/patent/US10318899B2,US10318899B2,Multiple resource planning system,2013-11-13,"system, managing, remote, doctor, medical, request, workflow, may","
     A system for managing remote doctor medical request workflow may include a workflow module that optimizes assignments of medical requests to remote doctors based on parameterized doctor and scheduling information and may further include a forecasting module that predicts the hospital credentials, state licenses or doctors needed to fulfill a projected volume of future medical requests. In one embodiment, radiologists are parameterized and then matched with requests for radiological readings based on information extracted from DICOM image headers and merged with associated information contained in a medical work order. In this embodiment, the radiologists are parameterized based on their locations, schedules, hospital credentials, state licensing, compensation metrics, and performance metrics and incoming requests for review of CT scans and the like are filtered based on the parameterized radiologist information to identify one or more radiologists who are to fulfill the medical request. 
   
   ",Intelligence Artificielle,"Brent Backhaus, Lorna Lusic, Dean Ebesu",Virtual Radiologic Corp,Active,,,
https://patents.google.com/patent/US10318915B2,US10318915B2,Healthcare system for recording and monitoring transactions of system participants,2013-09-25,"centrally, controlled, healthcare, environment, interconnects, manufacturers, medical, products,","
     A centrally controlled healthcare environment interconnects manufacturers of medical products, healthcare providers, and patients in a manner that provides a variety of functionalities. A particularly advantageous application of the system provides a mechanism for regulating and recording the flow of free drug samples from manufacturers to healthcare providers and then to patients. This involves a method by which a unique record is created each time it changes hands on the way from the manufacturer to the patient. A machine-readable unique code assigned to the sample is scanned automatically when the sample it is withdrawn from inventory at the manufacturer. The code and a unique identity of the individual withdrawing the sample are stored as a first record. This process is repeated at each location and for each individual handling the sample, including when it reaches the healthcare provider. Thus, a series of unique records is created that track the sample. 
   
   ",Autre,Rana J. Arefieg,Thuban Inc,"Expired - Fee Related, expires 2036-06-04",,,
https://patents.google.com/patent/US10318916B2,US10318916B2,Apparatus and method of identifying and sizing clothing in an inventory management system,2014-08-28,"invention, relates, method, identifying, merchandise","
     The present invention relates to a method of identifying merchandise in an inventory system, including: receiving and storing a design in a database of a computer system; developing a pattern from the design and storing the pattern in the database; sending the pattern to a cutting or pattern device, to cut a material for manufacture of the merchandise; capturing and storing images from the cut of the material for the merchandise using an image capturing device, to obtain pattern information and measurements; sending the captured images, pattern information and measurements, to an enterprise resource planning system for manufacture and processing; embedding a unique identification into each piece of merchandise during manufacture and processing; and captured, tagging, and storing images of the manufactured and processed piece of merchandise with the embedded identification, in the inventory system. 
   
   ",Télécommunications,Frances Barbaro Altieri,Altieri Frances Barbaro,"Active, expires 2038-02-15",,,
https://patents.google.com/patent/US10318922B2,US10318922B2,System and method for automatic insertion of call intelligence in an information system,2009-03-16,"Systems, methods, providing, automatic, insertion, call, intelligence","
     Systems and methods for providing automatic insertion of call intelligence in an information system are provided. In exemplary embodiments, new call detail records are accessed. At least one individual associated with the new call detail record may then be identified, and a subject matter associated with the new call detail record determined. A call intelligence record based on the identified individual and the subject matter is then generated and automatically inserted into the information system. 
   
   ",Intelligence Artificielle,Christopher M. Lyman,Sangoma US Inc,Active,,,
https://patents.google.com/patent/US10318927B2,US10318927B2,"Method and system for managing, matching, and sourcing employment candidates in a recruitment campaign",2018-05-01,"method, system, automating, aspects","
     A method and system for automating some aspects of a recruiting process, which may implement rules permitting the processes of sourcing candidates, setting up job interviews, and responding to candidate questions to all be automated with a computer. An automated system may specifically be used for conducting a conversation with a candidate over one or more communications channels, which may include pre-interview vetting of the candidate and clarification of aspects of the candidate's provided information, and may include conducting an interview or some aspects thereof. It may also be understood that an automated system may, in addition to conversing with the candidate, be used to provide feedback or additional opportunities to the candidate. 
   
   ",Intelligence Artificielle,Paul CHAMPANERIA,Experthiring LLC,"Active, expires 2037-07-29",,,
https://patents.google.com/patent/US10318932B2,US10318932B2,Payment card processing system with structure preserving encryption,2011-06-07,"customer, may, provide, merchant, primary, account, number","
     A customer may provide a merchant with primary account number information in connection with a purchase transaction. The merchant may send an associated authorization request to a payment card processor. A tokenization server at the payment card processor may generate a token corresponding to the primary account number. To secure the token, the token may be encrypted at the payment card processor using a cryptographic key shared with the merchant. A structure preserving encryption algorithm may be used in encrypting the token. A processor identifier may be embedded in the encrypted version of the token during the structure preserving encryption operation. The merchant can use the shared key to decrypt the token and extract the processor identifier. A settlement request may be directed to the processor from the merchant to settle the transaction using the processor identifier. 
   
   ",Autre,"Mark F. Bower, Matthew J. Pauker, Terence Spies",Micro Focus LLC,"Active, expires 2035-06-13",,,
https://patents.google.com/patent/US10318934B2,US10318934B2,Electronic payment and authentication system with debit and identification data verification and electronic check capabilities,2013-02-25,"electronic, payment, authentication, system, features","
     An electronic payment and authentication system that includes features to verify the authenticity of a payer, validate debit data, and facilitate debit (as opposed to credit) payment transactions. The electronic payment system allows a consumer to purchase items and services via a network while utilizing a debit transaction. The invention provides merchants with the ability to verify the identity of the consumer, determine if the consumer is a good debit transaction risk, and retrieve debit data associated with a particular consumer. 
   
   ",Télécommunications,"Whitney Hilton Stewart, Matthew Lacey Petersen, Brian John Gallmeier, Teresa Marie Crews, Mark Andrew Nipe, James Michael Haire, Robert Lawrence Hill, Michael Richard Bates",Fidelity Information Services LLC,"Expired - Fee Related, expires 2022-08-09",,,
https://patents.google.com/patent/US10318938B2,US10318938B2,System for routing of process authorization and settlement to a user in process data network based on specified parameters,2016-02-22,"Embodiments, enable, system, operatively, connected, block, chain","
     Embodiments enable a system operatively connected with a block chain distributed network to use the block chain for routing of process authorization and settlement based on specified parameters. Embodiments receive a transaction record associated with a payment transaction, wherein the transaction record comprises transaction data indicating a payor, a payee and an amount; access a distributed ledger stored in the memory device, wherein the distributed ledger is updated based on communications from a block chain distributed network; determine, using the accessed distributed ledger, one or more preferences associated with the payee of the transaction data; and route at least one of the process authorization and transaction settlement based on the accessed one or more preferences. In some cases, the preferences include a settlement routing preference and the transaction settlement is routed based on the settlement routing preference. 
   
   ",Télécommunications,"Darrell Johnsrud, Manu Jacob Kurian, Michael Wuehler",Bank of America Corp,"Active, expires 2037-09-19",,,
https://patents.google.com/patent/US10318956B2,US10318956B2,Systems and methods for utilization of earned but unpaid income,2016-09-06,"Systems, methods, providing, access, earned, but, unpaid","
     Systems and methods of providing access to earned but unpaid income are provided. An available balance of earned but unpaid income is computed. A login request and device information may be received from a remote device and a login procedure may be invoked based on an assessed security level of the login device type. On authenticating the remote device successfully, the available balance of earned but unpaid income may be recomputed. A list of financial services is displayed to the user, and a request may be received from the remote device for access to earned but unpaid income specifying a financial service, an amount and a deduction schedule. Terms and conditions of a transaction, including a fee are displayed and a signal indicating acceptance is received. The request may be fulfilled and a deduction file associated with an employer of the user is updated. 
   
   ",Télécommunications,"Safwan Shah, Sohail Aslam, Ijaz Anwar",Payactiv Inc,"Active, expires 2035-09-18",,,
https://patents.google.com/patent/US10318959B2,US10318959B2,System and methods to prevent unauthorized usage of card readers,2018-07-26,"contactless, card, reader, comprises, contactless, card, reader, front-end","
     A contactless card reader comprises a contactless card reader front-end coupled to a processor. A communications module is coupled to the processor and a set of sensors is coupled to the processor. The set of sensors determines parameters related to the location, orientation and motion of the card reader. The processor receives the parameters from the set of sensors and utilizes the parameters and scenario configuration data to evaluate a rule. The result of the evaluation of the rule results in a limitation on the operation of the card reader. The communications module is configured to intermittently receive the scenario configuration data from external sources. 
   
   ",Télécommunications,"Hwai Sian Tsai, Chi Wah Lo",Stripe Inc,Active,,,
https://patents.google.com/patent/US10318962B2,US10318962B2,Authenticity label for items,2014-11-17,"Disclosed, various, embodiments, multi-layer, identifier, labels.","
     Disclosed are various embodiments of multi-layer identifier labels. In one embodiment, a multi-layer identifier label includes an upper layer bearing a public identifier, a lower layer bearing a private identifier, and an adhesive backing below the lower layer. The upper layer may be removably attached to the lower layer, and the lower layer may be non-visible underneath the upper layer. Peeling away the upper layer to reveal the lower layer may be a tamper-evident action. 
   
   ",Autre,"Yair Rivlin, VI Samuel Pike Hall",Amazon Technologies Inc,"Active, expires 2037-10-10",,,
https://patents.google.com/patent/US10318964B2,US10318964B2,Systems and methods for detecting entity migration,2016-08-26,"Systems, methods, disclosed, detecting, entity, migration.","
     Systems and methods are disclosed herein for detecting entity migration. A method is provided for receiving container information for all known addresses in the United States. The container information can include address records, person or business entities associated with the address records, and temporal information associating the entities with the address records. The method includes determining, with one or more special-purpose computer processors in communication with a memory, migration data based on the container information. The method includes extracting metrics from the migration data. The metrics can include velocity of migration data; simultaneous movement of individuals within a predetermined time period; distance moved; and/or age of the person or business entities. The method can include determining, based at least in part on outliers associated with the metrics, one or more indicators of fraud; and outputting, for display, the one or more indicators of the fraud. 
   
   ",Intelligence Artificielle,"Jesse C P B Shaw, Johannes Philippus de Villiers Prichard, Eric Blood, Andrew John Bucholz",LexisNexis Risk Solutions FL Inc,"Active, expires 2037-01-01",,,
https://patents.google.com/patent/US10318965B2,US10318965B2,Method and apparatus for providing location specific information,2008-01-18,"method, apparatus, providing, location, specific, information., Event","
     A method and apparatus for providing location specific information. Event data pertaining to an event is received from an event reporting system that has gathered the event data from a data gathering means. The event data includes location identification data, event type data, and event description data. At least one geofence associated with the location identification data is identified from the location identification data in the received event data. Each geofence of the at least one geofence has a geometric shape located within a geographic area. A topic associated with the event type data and associated with the identified at least one geofence is identified. Subscribers having a subscription to the topic in association with the geographic area are identified. The subscription entitles the subscribers to be notified about events pertaining to the topic in association with the selected geographic area. The event description data is published to each subscriber. 
   
   ",Intelligence Artificielle,"Christopher Peter Drabble, Gary Paul Noble",Kyndryl Inc,"Active, expires 2032-12-21",,,
https://patents.google.com/patent/US10318967B2,US10318967B2,End-to-end effective citizen engagement via advanced analytics and sensor-based personal assistant capability (EECEASPA),2016-02-11,"Providing, end-to-end, citizen, engagement,, aspect,, may, comprise","
     Providing an end-to-end citizen engagement, in one aspect, may comprise obtaining data of multiple disintegrated sources from one or more of communication and social computing channels via one or more adapters. Data refactoring and management, integration and process orchestration of the data according to a data model as data attributes of the data model may be provided. One or more analytics may be performed based on the data attributes stored according to the data model and input specified to the one or more analytics. One or more results computed by performing the one or more analytics may be provided. One or more application logics supporting one or more front-end applications may be produced. One or more front-end applications for automated sensing of user activities and sensor-based personal assistant capability may be provided. 
   
   ",Télécommunications,"Tian-Jy Chao, Younghun Kim, Stephen E. Levy, Ming Li, Milind R. Naphade, Sambit Sahu",International Business Machines Corp,"Expired - Fee Related, expires 2035-10-05",,,
https://patents.google.com/patent/US10318970B2,US10318970B2,Generating a succinct approximate representation of a time series,2013-10-04,"Embodiments, invention, provide, system,, method","
     Embodiments of the present invention provide a system, method and computer program product for generating a succinct approximate representation of a time series. A method comprises determining at least one peak data value and at least one trough data value of an input series comprising a sequence of data values over time. The input series is partitioned into multiple segments comprising at least one rising segment that rises to a peak data value and at least one falling segment that falls to a trough data value. A sequence of segments that rise and fall alternately is generated based on the segments. A sequence of totals representing a succinct approximate representation of the input series is generated. Each total comprises a sum of data values for a corresponding segment of the sequence of segments. 
   
   ",Télécommunications,"Jeanette L. Blomberg, Neil H. A. Boyette, Anca A. Chandra, Se Chan Oh, Hovey R. Strong, Jr.",International Business Machines Corp,"Active, expires 2034-01-01",,,
https://patents.google.com/patent/US10318972B2,US10318972B2,Real time customer recategorization,2015-01-21,"computer-implemented, method, responding, user, behaviors, storing","
     A computer-implemented method for responding to user behaviors includes storing category specifications for a plurality of categories configured to characterize users, storing categories for users in a computer network system, detecting behaviors of a user in real time, and determining in real time if the behaviors of the user is within a first category specification associated with a first category that the user is tagged with. If the behaviors of the user exceed the first category specification, the method assigns a second category to the user in real time in response to the detected user behaviors. 
   
   ",Télécommunications,Ray Shan,Shutterfly LLC,"Active, expires 2036-04-29",,,
https://patents.google.com/patent/US10318973B2,US10318973B2,Probabilistic cross-device place visitation rate measurement at scale,2016-05-11,"process, including:, obtaining, network, traffic, logs;, matching","
     Provided is a process including: obtaining network traffic logs; matching a set of a plurality of the user computing devices; obtaining an indicator of content to be measured for effectiveness in driving place visits; selecting from the network traffic logs records of network exchanges in which the indicator is present; obtaining a device identifier from each of the selected records; matching the obtained device identifiers to respective matching sets including the respective obtained identifier; obtaining respective mobile device identifiers from the respective matching sets; selecting from the network traffic logs records indicating communications from mobile computing devices identified by the obtained mobile device identifiers; obtaining geolocations from the records indicating communications from the mobile computing devices identified; determining that a subset of the records have geolocations that correspond to at least one of a set of geographic areas; and determining an effectiveness of the content in driving visits. 
   
   ",Télécommunications,"Stephen Milton, Duncan McCall, Bishwaroop Ganguly",PlaceIQ Inc,"Active, expires 2034-04-23",,,
https://patents.google.com/patent/US10318975B2,US10318975B2,Identifying a case with a missing decision from a set of decision rules in violation of a decision requirement,2015-11-11,"Methods, identifying, case, missing, decision, from","
     Methods for identifying a case with a missing decision from a set of decision rules in violation of a decision requirement are provided. The set of decision rules and decision requirement are received, and a set of decisions made by the decision rules is obtained. A decision detection constraint graph is built, which represents, for each case used by the set of decision rules, whether each decision in the set of decisions is made or not by a decision rule in the set of decision rules. A decision requirement constraint graph is built from the decision requirement, which represents, for each case used by the set of decision rules, the decisions required. For each case used by the set of decision rules, the decision requirement constraint graph and the decision detection constraint graph for the case are used to identify if the case is a case with a missing decision. 
   
   ",Intelligence Artificielle,Ulrich M. Junker,International Business Machines Corp,"Active, expires 2038-04-11",,,
